product_name,category,slug,tagline,status,description,key_features,trade_fair_messaging,target_audience,landing_page_tone,trade_fair_name,trade_fair_dates,trade_fair_location,trade_fair_booth,story_id,story_uuid,page_url,sections_count,workflow_status,created_at
FalkenSense OptiLine 7000,Precision Optical Sensor,industry/hannover-messe-2026/optline-7000,"See the Invisible — Measure the Impossible",New Product Launch at HANNOVER MESSE 2026,"The FalkenSense OptiLine 7000 is FALKENBERG's next-generation confocal chromatic sensor for non-contact surface measurement. It achieves a breakthrough resolution of ±0.05 µm — twice the precision of the previous generation — while maintaining measurement rates of up to 70 kHz. Designed for demanding applications in semiconductor inspection, medical device manufacturing, and optical component quality control, the OptiLine 7000 measures virtually any surface: transparent, reflective, matte, or multi-layered.","±0.05 µm resolution (best-in-class for confocal chromatic sensors) | 70 kHz measurement rate for high-speed inline inspection | Multi-layer measurement: simultaneously capture thickness and surface profile of transparent coatings | Integrated LED status ring for at-a-glance sensor health monitoring | IP67-rated housing with M12 connectivity, operating range -20°C to +80°C | Plug-and-play compatibility with FalkenConnect IoT Gateway","We're unveiling the OptiLine 7000 at HANNOVER MESSE 2026 — the most precise confocal chromatic sensor we've ever built. Visit us at Hall 11, Stand B42 for a live demonstration on multi-layer glass measurement. See sub-micron features that other sensors simply miss.","Quality engineers in semiconductor, medical device, and optics manufacturing; R&D lab managers; OEM integration partners building inline inspection systems","Exciting product launch energy. Emphasize world premiere at HANNOVER MESSE, breakthrough specs, live demo invitation. Balance technical depth with accessibility.",HANNOVER MESSE 2026,20 – 24 April 2026,"Exhibition Grounds, Hannover, Germany","Hall 11, Stand B42",,,,,,
FalkenConnect Gateway Pro X,Industrial IoT Gateway,industry/hannover-messe-2026/falkenconnect-pro-x,"Every Sensor. Every Protocol. One Platform.",Major Update — New AI Edge Processing Module,"The FalkenConnect Gateway Pro X is the latest evolution of FALKENBERG's Industrial IoT platform, now featuring an integrated AI edge processing module. The Pro X connects up to 128 sensors (analog and digital) from any manufacturer, processes data locally using pre-trained anomaly detection models, and streams results to any cloud or on-premise platform via OPC UA, MQTT, REST, or Modbus. The new AI module enables predictive quality alerts directly at the sensor level — no cloud round-trip required, reducing reaction time from minutes to milliseconds.","128-channel sensor input (analog 4–20 mA, voltage, digital IO, HART, IO-Link) | Built-in AI edge processor with pre-trained models for vibration anomaly, drift detection, and predictive maintenance | Protocol support: OPC UA, MQTT, REST API, Modbus TCP/RTU, PROFINET, EtherNet/IP | Web-based configuration UI — no programming required; drag-and-drop data flow editor | Redundant power supply, DIN-rail mount, -40°C to +70°C operating range | Cybersecurity: IEC 62443 certified, encrypted data transmission, role-based access","See AI meet the factory floor at HANNOVER MESSE 2026. The FalkenConnect Pro X brings machine learning to your sensor data — right at the edge. Watch live as our gateway detects a simulated bearing failure 47 minutes before it happens, using nothing but vibration sensor data and on-device AI. Hall 11, Stand B42.","Plant managers evaluating Industry 4.0 / digital transformation; IT/OT convergence teams; automation engineers integrating multi-vendor sensor networks; predictive maintenance managers","Innovation-forward, Industry 4.0 leadership. Emphasize AI edge computing, multi-protocol flexibility, and the live predictive maintenance demo. Position FALKENBERG as a technology leader, not just a sensor company.",HANNOVER MESSE 2026,20 – 24 April 2026,"Exhibition Grounds, Hannover, Germany","Hall 11, Stand B42",,,,,,
FalkenSense InduLine IS-500,Inductive Displacement Sensor,industry/hannover-messe-2026/induline-is-500,"Built for the Harshest Environments. Trusted for the Finest Measurements.",Product Line Extension — New Extreme Environment Variants,"The FalkenSense InduLine IS-500 is FALKENBERG's ruggedized inductive displacement sensor series, engineered for reliable micron-level measurement in extreme industrial environments. The new 2026 variants extend the operating temperature range to -60°C to +200°C and add IP69K certification for high-pressure washdown resistance. The IS-500 is the go-to sensor for steel mills, foundries, offshore platforms, and heavy machinery OEMs where conventional sensors fail.","Measurement range: 0.5 mm to 50 mm, resolution down to ±0.5 µm | Extended temperature range: -60°C to +200°C (with active cooling option for +300°C environments) | IP69K housing: withstands 80°C water jets at 100 bar pressure | Eddy-current principle: immune to oil, dust, coolant, and electromagnetic interference | Titanium alloy sensor head option for corrosive environments (salt spray, acids) | Integrated temperature compensation for <0.01% full-scale drift across the entire operating range","Precision doesn't stop where conditions get extreme. The new InduLine IS-500 delivers micron-level accuracy at 200°C, under 100-bar washdown, through oil, dust, and electromagnetic noise. At HANNOVER MESSE, we'll demonstrate live measurement in a simulated steel mill environment — come feel the heat at Hall 11, Stand B42.","Maintenance and reliability engineers in heavy industry (steel, mining, oil & gas); OEM machine builders for extreme-environment applications; offshore and energy sector engineers","Rugged, confident, no-nonsense. Emphasize extreme durability and reliability. Appeal to engineers who've been burned by sensors that fail in the field. Proof through specs, not hype.",HANNOVER MESSE 2026,20 – 24 April 2026,"Exhibition Grounds, Hannover, Germany","Hall 11, Stand B42",,,,,,
FalkenCalib QuickCheck QC-200,Portable Calibration System,industry/hannover-messe-2026/quickcheck-qc-200,"Lab-Grade Calibration. Anywhere on the Shop Floor.",New Product — Expanding into Portable Metrology,"The FalkenCalib QuickCheck QC-200 is FALKENBERG's first portable calibration system, bringing ISO 17025-traceable verification directly to the production line. Instead of shipping sensors back to the calibration lab — a process that can take weeks and leaves measurement gaps — the QC-200 lets quality technicians verify sensor accuracy on-site in under 10 minutes. The system includes a set of certified reference standards, a ruggedized tablet interface, and automatic calibration certificate generation with digital signatures.","Supports calibration verification for inductive, capacitive, and optical sensors | ISO 17025-traceable reference standards included (DAkkS-certified) | Calibration check completed in under 10 minutes per sensor | Ruggedized 10-inch tablet with guided workflow — step-by-step instructions, no metrology expertise required | Automatic PDF/XML calibration certificate generation with digital signature and QR code | Wireless data sync to FalkenConnect platform for fleet-wide calibration status dashboard | Pelican-style carrying case, rated for field use and air travel","Stop shipping sensors to the lab. The new FalkenCalib QuickCheck QC-200 brings ISO 17025-traceable calibration verification to your shop floor — in under 10 minutes. At HANNOVER MESSE, try it yourself: grab the tablet, follow the guided workflow, and verify a sensor's accuracy on our demo stand. It's that simple. Hall 11, Stand B42.","Quality managers concerned about calibration downtime; plant metrology teams; companies with large installed sensor fleets seeking to reduce calibration turnaround time and costs","Problem-solution framing. Lead with the pain (calibration downtime, shipping delays, measurement gaps) and position QC-200 as the elegant fix. Hands-on, approachable — try it yourself energy.",HANNOVER MESSE 2026,20 – 24 April 2026,"Exhibition Grounds, Hannover, Germany","Hall 11, Stand B42",,,,,,
FalkenSense CapLine CS-350 Hygienic,Capacitive Sensor for Hygienic / Cleanroom Applications,industry/hannover-messe-2026/capline-cs-350,"Precision Meets Purity.",New Variant — Hygienic Design for Pharma & Food,"The FalkenSense CapLine CS-350 Hygienic is a capacitive proximity and displacement sensor specifically designed for pharmaceutical, food & beverage, and semiconductor cleanroom environments. Its electropolished 316L stainless steel housing with EHEDG-certified hygienic design eliminates crevices where bacteria or particles could accumulate. The sensor meets FDA 21 CFR Part 11 data integrity requirements, making it suitable for GMP-regulated manufacturing lines. It measures fill levels, distances, and material thickness on both conductive and non-conductive targets — without physical contact.","EHEDG-certified hygienic design, CIP/SIP compatible (Clean-in-Place / Sterilize-in-Place) | Electropolished 316L stainless steel housing, Ra < 0.4 µm surface finish | FDA 21 CFR Part 11 compliant data output with audit trail | Measurement range: 0.1 mm to 10 mm, resolution ±1 µm | Non-contact capacitive measurement works on metals, plastics, glass, liquids, and powders | ISO 14644-1 Class 5 cleanroom compatible (generates zero particles) | IP69K rated, autoclavable up to 134°C","Where hygiene is non-negotiable, every sensor component matters. The new CapLine CS-350 Hygienic combines EHEDG-certified design with micron-level capacitive measurement — purpose-built for pharma fill lines, food processing, and semiconductor fabs. Visit Hall 11, Stand B42 at HANNOVER MESSE to see our cleanroom-ready sensor demo and discuss your hygienic measurement challenges with our application engineers.","Pharmaceutical production engineers and quality/compliance managers; food & beverage process engineers; semiconductor fab equipment designers; cleanroom equipment OEMs","Clean, precise, compliance-aware. Emphasize certifications (EHEDG, FDA, ISO) and hygienic design. Speak the language of regulated industries — validation, traceability, audit trails. Professional trust-building.",HANNOVER MESSE 2026,20 – 24 April 2026,"Exhibition Grounds, Hannover, Germany","Hall 11, Stand B42",,,,,,
FalkenInspect MultiScan M-3000,Automated Multi-Sensor Measurement System,industry/hannover-messe-2026/multiscan-m-3000,"One Station. Every Dimension. Zero Defects.",New Product Launch — Turnkey Inline Inspection,"The FalkenInspect MultiScan M-3000 is FALKENBERG's first turnkey automated measurement station, combining optical, inductive, and capacitive sensors in a single inspection cell. Designed for 100% inline quality inspection on production lines, the M-3000 measures up to 48 dimensional features per part in under 3 seconds — replacing manual CMM sampling that catches only 1–2% of production. The system uses a 6-axis robotic sensor arm, automatic part recognition via integrated vision, and real-time SPC dashboards streamed through FalkenConnect. Pre-configured measurement recipes for automotive, medical device, and electronics applications reduce commissioning time from weeks to days.","Multi-sensor fusion: optical (±0.1 µm), inductive (±0.5 µm), and capacitive (±1 µm) sensors in one cell | 48 measurement features per part in under 3 seconds cycle time | 6-axis robotic sensor arm with automatic tool change between sensor types | Integrated 2D/3D vision for automatic part recognition and alignment — no fixtures required | Real-time SPC dashboards and trend analysis via FalkenConnect IoT Gateway | Pre-configured measurement recipes for common part families (reduce commissioning from weeks to days) | Compact footprint (1.8 × 1.2 m) fits into existing production lines without layout changes","Meet the future of inline quality inspection at HANNOVER MESSE 2026. The new FalkenInspect MultiScan M-3000 replaces slow CMM sampling with 100% automated measurement — 48 features per part in under 3 seconds. Watch a live demo of our multi-sensor robotic inspection cell at Hall 11, Stand B42 and see how three sensor technologies work together in one compact station.","Quality managers transitioning from CMM sampling to 100% inline inspection; production engineers seeking to reduce scrap and rework costs; automotive Tier-1 suppliers facing OEM mandates for 100% traceability; plant managers evaluating ROI of automated inspection vs. manual quality control","Transformational, ROI-focused. Lead with the business case (100% inspection vs. 1–2% sampling, scrap reduction, traceability). Show the live demo as proof. Speak to both the quality engineer (specs, accuracy) and the plant manager (ROI, footprint, commissioning speed).",HANNOVER MESSE 2026,20 – 24 April 2026,"Exhibition Grounds, Hannover, Germany","Hall 11, Stand B42",,,,,,
